{
  "schemaVersion": 3,
  "problemId": "bssc-sum-capacity",
  "ledgerHead": null,
  "baseStateDigest": null,
  "rootProgramId": "root",
  "programs": {
    "root": {
      "id": "root",
      "parentId": null,
      "title": "Canonical problem",
      "objective": "Resolve the canonical problem.",
      "currentStateSummary": "No accepted intermediate results yet.",
      "localResidualSummary": "All unresolved work remains local until it is organized into child programs.",
      "status": "active",
      "intermediateResultIds": [],
      "sourceTransactionIds": [],
      "lineage": [],
      "digest": "sha256:0e2105eed3374786b015bb4806ddca7f50f84b9f12d1c47ceb3a60d43a187681"
    }
  },
  "intermediateResults": {},
  "contributions": {},
  "stateDigest": "sha256:caaeeb5894c3e77c4e222c5c0e04b281ebf89fab1afe269576fe7b7098c29822"
}
